<?xml version="1.0" encoding="UTF-8"?>
<!--
To change this license header, choose License Headers in Project Properties.
To change this template file, choose Tools | Templates
and open the template in the editor.
-->


<email
    xmlns:xsi='http://www.w3.org/2001/XMLSchema-instance'
    xsi:noNamespaceSchemaLocation='01.xsd'>
    <remitente></remitente>
    <destinatario></destinatario>
    <destinatario></destinatario>
    <destinatario></destinatario>
    <fecha></fecha>
    <asunto></asunto>
    <mensaje></mensaje>
    <fichero>
        <nombre></nombre>
        <type></type>
    </fichero>
    <fichero>
        <nombre></nombre>
        <type></type>
    </fichero>
    <fichero>
        <nombre></nombre>
        <type></type>
    </fichero>

</email>
